{
  "version": 1,
  "required_level": "quick",
  "setup": "npm install --ignore-scripts",
  "commands": {
    "quick": "python3 scripts/roach_check.py && npm run check",
    "full": "python3 scripts/roach_check.py && npm run check && python3 .agent/tests/run_template_tests.py --fast",
    "smoke": null
  },
  "notes": "Quick verification now covers both Roach coordination health and the TypeScript/Three.js/Rapier browser runtime. Map-compiler tasks must add Python compiler tests; T014 must add an automated browser smoke command."
}
